{
  "schemaVersion": 3,
  "name": "default-balanced",
  "description": "推荐默认：叠在 base-full 之上，保留功能性组件 —— WLAN、Hyper-V/虚拟机平台、Remote Access/RAS、蓝牙/音频/位置服务、消费级与遗留驱动全部不被裁剪（enabled:false 的 keep 层），只移除应用、Appx 与遥测类内容。极限精简请直接使用 base-full（或叠加自己的 overlay）。用法：--profile profiles/base-full.json --profile profiles/default-balanced.json，顺序不可颠倒。",
  "selections": [
    {
      "planId": "feature.wireless-networking",
      "enabled": false
    },
    {
      "planId": "feature.hyper-v",
      "enabled": false
    },
    {
      "planId": "feature.remote-access",
      "enabled": false
    },
    {
      "planId": "driver.non-consumer-extra",
      "enabled": false
    },
    {
      "planId": "service.bluetooth",
      "enabled": false
    },
    {
      "planId": "service.audio",
      "enabled": false
    },
    {
      "planId": "service.location",
      "enabled": false
    },
    {
      "planId": "registry.update-task-cache",
      "enabled": false
    }
  ]
}
