{
  "$schema": "../schemas/profile-v3.schema.json",
  "schemaVersion": 3,
  "name": "desktop-aggressive-next",
  "description": "第二阶段桌面精简：移除剩余可选 AppX、商店/Xbox 服务和无打印/远程管理组件；保留 Shell、中文输入、网络、音频、WOW64、WinRE、Search 和 .NET 4。",
  "selections": [
    {
      "planId": "appx.desktop-app-installer",
      "enabled": true
    },
    {
      "planId": "appx.modern-calculator",
      "enabled": true
    },
    {
      "planId": "appx.camera",
      "enabled": true
    },
    {
      "planId": "appx.alarms",
      "enabled": true
    },
    {
      "planId": "appx.dev-home",
      "enabled": true
    },
    {
      "planId": "appx.quick-assist",
      "enabled": true
    },
    {
      "planId": "appx.sticky-notes",
      "enabled": true
    },
    {
      "planId": "appx.screen-sketch",
      "enabled": true
    },
    {
      "planId": "appx.modern-notepad",
      "enabled": true
    },
    {
      "planId": "appx.modern-paint",
      "enabled": true
    },
    {
      "planId": "appx.web-experience",
      "enabled": true
    },
    {
      "planId": "appx.cross-device",
      "enabled": true
    },
    {
      "planId": "service.xbox-gaming",
      "enabled": true
    },
    {
      "planId": "service.store-install",
      "enabled": true
    },
    {
      "planId": "service.license-manager",
      "enabled": true
    },
    {
      "planId": "service.token-broker",
      "enabled": true
    },
    {
      "planId": "service.user-data-services",
      "enabled": true
    },
    {
      "planId": "service.print-config",
      "enabled": true
    },
    {
      "planId": "service.print-spooler",
      "enabled": true
    },
    {
      "planId": "service.remote-access-connection-manager",
      "enabled": true
    },
    {
      "planId": "service.windows-remote-management",
      "enabled": true
    },
    {
      "planId": "service.wpad",
      "enabled": true
    },
    {
      "planId": "feature.printing",
      "enabled": true
    },
    {
      "planId": "feature.smb-direct",
      "enabled": true
    },
    {
      "planId": "feature.wcf",
      "enabled": true
    },
    {
      "planId": "driver.legacy-printing",
      "enabled": true
    },
    {
      "planId": "component.edge",
      "enabled": true
    },
    {
      "planId": "appx.security-health-ui",
      "enabled": true
    },
    {
      "planId": "capability.sense-client",
      "enabled": true
    },
    {
      "planId": "feature.windows-defender",
      "enabled": true
    }
  ]
}
