{
  "schemaVersion": 3,
  "name": "standard-safe",
  "description": "Validated desktop-safe baseline plan selection.",
  "selections": [
    {
      "planId": "service.font-cache",
      "enabled": true
    },
    {
      "planId": "service.server",
      "enabled": true
    },
    {
      "planId": "service.user-access-logging",
      "enabled": true
    },
    {
      "planId": "service.workstation",
      "enabled": true
    },
    {
      "planId": "service.biometric",
      "enabled": true
    },
    {
      "planId": "service.bluetooth",
      "enabled": true
    },
    {
      "planId": "service.clipboard-user",
      "enabled": true
    },
    {
      "planId": "service.compatibility-assistant",
      "enabled": true
    },
    {
      "planId": "service.connected-devices-platform",
      "enabled": true
    },
    {
      "planId": "service.data-usage",
      "enabled": true
    },
    {
      "planId": "service.diagnostic-tracking",
      "enabled": true
    },
    {
      "planId": "service.edge-update",
      "enabled": true
    },
    {
      "planId": "service.inventory",
      "enabled": true
    },
    {
      "planId": "service.location",
      "enabled": true
    },
    {
      "planId": "service.maps-broker",
      "enabled": true
    },
    {
      "planId": "service.network-discovery",
      "enabled": true
    },
    {
      "planId": "service.phone",
      "enabled": true
    },
    {
      "planId": "service.push-notifications",
      "enabled": true
    },
    {
      "planId": "service.sysmain",
      "enabled": true
    },
    {
      "planId": "service.telephony",
      "enabled": true
    },
    {
      "planId": "service.diagnostic-policy",
      "enabled": true
    },
    {
      "planId": "service.wdi-service-host",
      "enabled": true
    },
    {
      "planId": "service.wdi-system-host",
      "enabled": true
    },
    {
      "planId": "service.windows-error-reporting",
      "enabled": true
    },
    {
      "planId": "appx.bing-news",
      "enabled": true
    },
    {
      "planId": "appx.bing-weather",
      "enabled": true
    },
    {
      "planId": "appx.calculator",
      "enabled": true
    },
    {
      "planId": "appx.clipchamp",
      "enabled": true
    },
    {
      "planId": "appx.feedback-hub",
      "enabled": true
    },
    {
      "planId": "appx.gaming-app",
      "enabled": true
    },
    {
      "planId": "appx.get-help",
      "enabled": true
    },
    {
      "planId": "appx.mail-calendar",
      "enabled": true
    },
    {
      "planId": "appx.maps",
      "enabled": true
    },
    {
      "planId": "appx.office-hub",
      "enabled": true
    },
    {
      "planId": "appx.people",
      "enabled": true
    },
    {
      "planId": "appx.photos",
      "enabled": true
    },
    {
      "planId": "appx.power-automate",
      "enabled": true
    },
    {
      "planId": "appx.solitaire",
      "enabled": true
    },
    {
      "planId": "appx.sound-recorder",
      "enabled": true
    },
    {
      "planId": "appx.todos",
      "enabled": true
    },
    {
      "planId": "appx.windows-terminal",
      "enabled": true
    },
    {
      "planId": "appx.xbox",
      "enabled": true
    },
    {
      "planId": "appx.your-phone",
      "enabled": true
    },
    {
      "planId": "appx.zune-music",
      "enabled": true
    },
    {
      "planId": "appx.zune-video",
      "enabled": true
    },
    {
      "planId": "maintenance.component-cleanup",
      "enabled": true
    },
    {
      "planId": "capability.braille-support",
      "enabled": true
    },
    {
      "planId": "capability.chinese-handwriting",
      "enabled": true
    },
    {
      "planId": "capability.chinese-ocr",
      "enabled": true
    },
    {
      "planId": "capability.chinese-speech",
      "enabled": true
    },
    {
      "planId": "capability.chinese-text-to-speech",
      "enabled": true
    },
    {
      "planId": "feature.enhanced-storage",
      "enabled": true
    },
    {
      "planId": "feature.fax",
      "enabled": true
    },
    {
      "planId": "capability.internet-explorer",
      "enabled": true
    },
    {
      "planId": "feature.legacy-components",
      "enabled": true
    },
    {
      "planId": "feature.media",
      "enabled": true
    },
    {
      "planId": "capability.notepad",
      "enabled": true
    },
    {
      "planId": "capability.onesync",
      "enabled": true
    },
    {
      "planId": "capability.openssh-client",
      "enabled": true
    },
    {
      "planId": "capability.paint",
      "enabled": true
    },
    {
      "planId": "capability.powershell-ise",
      "enabled": true
    },
    {
      "planId": "feature.powershell-v2",
      "enabled": true
    },
    {
      "planId": "feature.ras-connection-manager",
      "enabled": true
    },
    {
      "planId": "feature.rds-management-tools",
      "enabled": true
    },
    {
      "planId": "feature.remote-desktop-client",
      "enabled": true
    },
    {
      "planId": "feature.server-backup",
      "enabled": true
    },
    {
      "planId": "feature.simple-tcp",
      "enabled": true
    },
    {
      "planId": "feature.smb1",
      "enabled": true
    },
    {
      "planId": "capability.snipping-tool",
      "enabled": true
    },
    {
      "planId": "feature.snmp",
      "enabled": true
    },
    {
      "planId": "capability.steps-recorder",
      "enabled": true
    },
    {
      "planId": "feature.telnet-client",
      "enabled": true
    },
    {
      "planId": "feature.tftp-client",
      "enabled": true
    },
    {
      "planId": "feature.windows-admin-center",
      "enabled": true
    },
    {
      "planId": "feature.wireless-networking",
      "enabled": true
    },
    {
      "planId": "capability.wmic",
      "enabled": true
    },
    {
      "planId": "feature.workfolders",
      "enabled": true
    },
    {
      "planId": "feature.xps",
      "enabled": true
    },
    {
      "planId": "fs.inetpub",
      "enabled": true
    },
    {
      "planId": "registry.chat",
      "enabled": true
    },
    {
      "planId": "registry.consumer-features",
      "enabled": true
    },
    {
      "planId": "registry.edge-background-mode",
      "enabled": true
    },
    {
      "planId": "registry.feeds",
      "enabled": true
    },
    {
      "planId": "registry.server-manager-autostart",
      "enabled": true
    },
    {
      "planId": "registry.suggested-apps",
      "enabled": true
    }
  ]
}
